source_row,username,name,ig_handle,ig_url,original_category,original_industry,original_message_cleaned,message_english,age,years_of_experience_skills,skills_detailed,skill_category,source_skill_field,source_experience_field,scraped_at
561,anehnyakita,anehnyakita anehnyakita Hi,@anehnyakita,https://www.instagram.com/anehnyakita/,Agency,Teknologi,"Hi, I know in this fast-paced world your time is very precious. Instead of wasting it searching for ideas, just leave it to me. I'm a content writer for social media and long-form videos. I'll provide you with a script that you can read and apply easily. I'm very open to all","Hi, I know in this fast-paced world your time is very precious. Instead of wasting it searching for ideas, just leave it to me. I'm a content writer for social media and long-form videos. I'll provide you with a script that you can read and apply easily. I'm very open to all",Not mentioned,Not mentioned,"social media, writer, content writer","Social Media & Community, Writing & Content",Tidak terdeteksi,Tidak disebutkan,46190.438287557874
655,aslamhd_,Hi! I'm Aslam,@aslamhd_,https://www.instagram.com/aslamhd_/,Lainnya,Teknologi,"Hi! I'm Aslam, i can be your ghost writer on threads, X, or any text based social media. If you want the world to know your brand, we can do something! Hit me up.","Hi! I'm Aslam, i can be your ghost writer on threads, X, or any text based social media. If you want the world to know your brand, we can do something! Hit me up.",Not mentioned,Not mentioned,"social media, writer","Social Media & Community, Writing & Content",Tidak terdeteksi,Tidak disebutkan,46190.43828761574
613,hxnlls,hxnlls,@hxnlls,https://www.instagram.com/hxnlls/,Lainnya,Teknologi,"Hi! I'm a Content Writer and Creative Copywriter with experience in social media content, website copy, and UX writing. I can help create clear, engaging, and conversion-focused content. Rates start at just $5. Feel free to DM me if you're interested!","Hi! I'm a Content Writer and Creative Copywriter with experience in social media content, website copy, and UX writing. I can help create clear, engaging, and conversion-focused content. Rates start at just $5. Feel free to DM me if you're interested!",Not mentioned,Not mentioned,"social media, writing, writer, ux, Content Writer","Social Media & Community, Writing & Content, UI/UX & Product Design",Tidak terdeteksi,Tidak disebutkan,46190.438287592595
137,vin.corn07,Hello people,@vin.corn07,https://www.instagram.com/vin.corn07/,Lainnya,Teknologi,"Hello people, i'm Vina. I am a girl who loves dancing. I have strong ballet technique and contamporarry dance. I have danced worldwidely. I might be young, but i'm experienced and still going. I love to grow and create with other artists. Let’s connect with me through DM!","Hello people, i'm Vina. I am a girl who loves dancing. I have strong ballet technique and contamporarry dance. I have danced worldwidely. I might be young, but i'm experienced and still going. I love to grow and create with other artists. Let’s connect with me through DM!",Not mentioned,Not mentioned,dance,Talent / Performing Arts,Tidak terdeteksi,Tidak disebutkan,46190.437632002315
46,ridzki.atmaji,ridzki.atmaji ridzki.atmaji Hi,@ridzki.atmaji,https://www.instagram.com/ridzki.atmaji/,Agency,Teknologi,"Hi, I’m Ridzki 👋 I’m a frontend developer from Indonesia with 6+ years building React, Next.js, and TypeScript products. I’m good at turning messy product ideas into clean web interfaces. I’ve worked on interactive game UI, startup products, Web3/payment flows, and an SM","Hi, I’m Ridzki 👋 I’m a frontend developer from Indonesia with 6+ years building React, Next.js, and TypeScript products. I’m good at turning messy product ideas into clean web interfaces. I’ve worked on interactive game UI, startup products, Web3/payment flows, and an SM",Not mentioned,6+ years,"react, developer, frontend",Technology & Engineering,react,6+ tahun,46190.43720050926
139,nathansept,Hi👋,@nathansept,https://www.instagram.com/nathansept/,Freelancer,Teknologi,"Hi👋, I'm Nathan, a Web Developer with a passion for building digital solutions that are both functional and impactful🔥. I enjoy transforming ideas into websites and web applications that help businesses and users achieve their goals more effectively. My journey in web development has given me the","Hi👋, I'm Nathan, a Web Developer with a passion for building digital solutions that are both functional and impactful🔥. I enjoy transforming ideas into websites and web applications that help businesses and users achieve their goals more effectively. My journey in web development has given me the",Not mentioned,Not mentioned,"web developer, developer",Technology & Engineering,Tidak terdeteksi,Tidak disebutkan,46190.437632002315
183,uiux.caksaji,uiux.caksaji,@uiux.caksaji,https://www.instagram.com/uiux.caksaji/,Developer,Teknologi,"You need website to boost your business to attract more potential. Hi 👋 I’m Aji, a website developer, ready to build cutom websites for you. You need marketplace, showcase, or even internal dashboard? Consider it done with me. 5+ years of experience across industries. See","You need website to boost your business to attract more potential. Hi 👋 I’m Aji, a website developer, ready to build cutom websites for you. You need marketplace, showcase, or even internal dashboard? Consider it done with me. 5+ years of experience across industries. See",Not mentioned,5+ years,developer,Technology & Engineering,Tidak terdeteksi,5+ tahun,46190.4378005787
203,malikinnn_20,malikinnn_20,@malikinnn_20,https://www.instagram.com/malikinnn_20/,Agency,Teknologi,"The world is rich with young, highly skilled talent, particularly in Indonesia. However, many Indonesian high school graduates and students face a significant barrier: a stark lack of access to international exposure and opportunities. My name is Luthfi Malik, and I am deep","The world is rich with young, highly skilled talent, particularly in Indonesia. However, many Indonesian high school graduates and students face a significant barrier: a stark lack of access to international exposure and opportunities. My name is Luthfi Malik, and I am deep",Not mentioned,Not mentioned,java,Technology & Engineering,java,20+ tahun,46190.43787226852
283,clvnthd,Hi,@clvnthd,https://www.instagram.com/clvnthd/,Designer,Desain & Kreatif,"Hi, i'm Celvin. Product Developer with 3+ years of experience in managing end to end product development, including OEM project, supplier sourcing, and cross functional coordination. Proven in working with international manufacturers (mostly in China), handling product costing and pricing analysis a","Hi, i'm Celvin. Product Developer with 3+ years of experience in managing end to end product development, including OEM project, supplier sourcing, and cross functional coordination. Proven in working with international manufacturers (mostly in China), handling product costing and pricing analysis a",Not mentioned,3+ years,developer,Technology & Engineering,Tidak terdeteksi,3+ tahun,46190.43810586805
346,_tegar.maulana,_tegar.maulana,@_tegar.maulana,https://www.instagram.com/_tegar.maulana/,Lainnya,Lainnya,"Hello I'am welder fabrication with 7 years experience , especially allumunium and stainless steel project. I can operate the TIG and MIG welding machine. Rate : 35 $ - 55 $. Depending on job level. Looking forward to hearing more about your requirement!! Feel free to re","Hello I'am welder fabrication with 7 years experience , especially allumunium and stainless steel project. I can operate the TIG and MIG welding machine. Rate : 35 $ - 55 $. Depending on job level. Looking forward to hearing more about your requirement!! Feel free to re",Not mentioned,7 years,react,Technology & Engineering,react,7+ tahun,46190.43823364584
386,_stivenlay_,_stivenlay_ _stivenlay_ ​Hi everyone!,@_stivenlay_,https://www.instagram.com/_stivenlay_/,Agency,Teknologi,"​Hi everyone! ⠀ I'm a Senior Developer with 6+ years of experience. I'm currently working full-time remotely for a company in New Zealand, but I am actively exploring new 100% remote opportunities. ⠀ If your team is hiring for senior tech roles, or if you know of any openings","​Hi everyone! ⠀ I'm a Senior Developer with 6+ years of experience. I'm currently working full-time remotely for a company in New Zealand, but I am actively exploring new 100% remote opportunities. ⠀ If your team is hiring for senior tech roles, or if you know of any openings",Not mentioned,6+ years,"developer, Senior Developer",Technology & Engineering,Tidak terdeteksi,6+ tahun,46190.43828746528
418,rumpun.id,Hello,@rumpun.id,https://www.instagram.com/rumpun.id/,Agency,Teknologi,"Hello, we’re RUMPUN (Rumah Pejuang Nusantara)—a small, dedicated creative agency and software developer based in Medan, Indonesia. We know that building high-quality digital products usually costs a fortune, but we believe you shouldn't have to overpay for top-tier talent. With 8 years of hands-on e","Hello, we’re RUMPUN (Rumah Pejuang Nusantara)—a small, dedicated creative agency and software developer based in Medan, Indonesia. We know that building high-quality digital products usually costs a fortune, but we believe you shouldn't have to overpay for top-tier talent. With 8 years of hands-on e",Not mentioned,8+ years,developer,Technology & Engineering,Tidak terdeteksi,8+ tahun,46190.438287488425
500,ulmauull,Hello everyone. 🙌,@ulmauull,https://www.instagram.com/ulmauull/,Startup,Teknologi,Hello everyone. 🙌 I'm not the most experienced developer. Not the largest software house. Not the most well-known tech founder. But I've spent 5 years sitting between IT infrastructure and software development. Learning how businesses struggle without the right systems. How manual processes slow do,Hello everyone. 🙌 I'm not the most experienced developer. Not the largest software house. Not the most well-known tech founder. But I've spent 5 years sitting between IT infrastructure and software development. Learning how businesses struggle without the right systems. How manual processes slow do,Not mentioned,5+ years,"developer, not the most experienced developer",Technology & Engineering,Tidak terdeteksi,5+ tahun,46190.438287523146
503,abelardhana,abelardhana abelardhana Hi everyone,@abelardhana,https://www.instagram.com/abelardhana/,Developer,Teknologi,"Hi everyone, my name is Abel Ardhana Simanungkalit. I'm a web app developer with 4 years of experience. I love developing software with best practices and scalability. Please check out my GitHub at https://github(.)com/abela-a. Let's collaborate! 🤝🏻","Hi everyone, my name is Abel Ardhana Simanungkalit. I'm a web app developer with 4 years of experience. I love developing software with best practices and scalability. Please check out my GitHub at https://github(.)com/abela-a. Let's collaborate! 🤝🏻",Not mentioned,4 years,"developer, web app developer",Technology & Engineering,Tidak terdeteksi,4+ tahun,46190.43828753472
529,rqii.pratama,rqii.pratama rqii.pratama Hello,@rqii.pratama,https://www.instagram.com/rqii.pratama/,Agency,Lainnya,"Hello, this time I am not offering a service, but a product. We have Java coffee beans ready for export, with 10 kg currently available in 250g, 500g, and 1kg packaging options. Larger orders can also be arranged based on buyer needs. We can also help source specialty coffe","Hello, this time I am not offering a service, but a product. We have Java coffee beans ready for export, with 10 kg currently available in 250g, 500g, and 1kg packaging options. Larger orders can also be arranged based on buyer needs. We can also help source specialty coffe",Not mentioned,Not mentioned,java,Technology & Engineering,java,Tidak disebutkan,46190.4382875463
533,ardy_sanka,ardy_sanka,@ardy_sanka,https://www.instagram.com/ardy_sanka/,Agency,Teknologi,"Hi! I’m a Backend Developer & Ops Specialist from Indonesia 🇮🇩 with over 9 years of experience building solid and scalable digital infrastructure. ​I help businesses build systems and applications that not only run smoothly, but are also easy to operate and maintain in the long run. ​✨ Core Expert","Hi! I’m a Backend Developer & Ops Specialist from Indonesia 🇮🇩 with over 9 years of experience building solid and scalable digital infrastructure. ​I help businesses build systems and applications that not only run smoothly, but are also easy to operate and maintain in the long run. ​✨ Core Expert",Not mentioned,9 years,"developer, backend",Technology & Engineering,Tidak terdeteksi,9+ tahun,46190.4382875463
547,obg_dukunberanak,obg_dukunberanak,@obg_dukunberanak,https://www.instagram.com/obg_dukunberanak/,Agency,Kesehatan,"Hello👋 The Innovators Studio, Name's Azrul Roe, 38th years and been aged enough.. As a newly certified Obstetrician and Gynecologist, my vision is to elevate the quality of Indonesia’s human resources by intervening at the very root: the preconception phase. I firm","Hello👋 The Innovators Studio, Name's Azrul Roe, 38th years and been aged enough.. As a newly certified Obstetrician and Gynecologist, my vision is to elevate the quality of Indonesia’s human resources by intervening at the very root: the preconception phase. I firm",Not mentioned,Not mentioned,react,Technology & Engineering,react,38+ tahun,46190.438287557874
632,danieljordannn,danieljordannn danieljordannn Ola,@danieljordannn,https://www.instagram.com/danieljordannn/,Developer,Teknologi,"Ola, im Jord a web developer with 5+ years of experience based in West Jakarta. • I could build professional websites and provide you web hosting that i managed on my own. • Kindly check out my portofolio at 🔗jord.id Rates: $100-$1500/Based on complexity","Ola, im Jord a web developer with 5+ years of experience based in West Jakarta. • I could build professional websites and provide you web hosting that i managed on my own. • Kindly check out my portofolio at 🔗jord.id Rates: $100-$1500/Based on complexity",Not mentioned,5+ years,"web developer, developer",Technology & Engineering,Tidak terdeteksi,5+ tahun,46190.43828760416
667,erandr.traup,erandr.traup erandr.traup Hello,@erandr.traup,https://www.instagram.com/erandr.traup/,Developer,Teknologi,"Hello, my name is Darren Oliver Putra Haryanto, I am currently working as a Software Lab assistant here in Indonesia. I have quite a lot of experience in the world of software, I am capable of doing DevOps work, coding using Next.js, React.js and much more, and I am eager t","Hello, my name is Darren Oliver Putra Haryanto, I am currently working as a Software Lab assistant here in Indonesia. I have quite a lot of experience in the world of software, I am capable of doing DevOps work, coding using Next.js, React.js and much more, and I am eager t",Not mentioned,Not mentioned,"react, coding",Technology & Engineering,react,Tidak disebutkan,46190.43828761574
144,kevinhutasuhut,kevinhutasuhut,@kevinhutasuhut,https://www.instagram.com/kevinhutasuhut/,Developer,Teknologi,"Need a modern website, business system, or AI powered solution? I'm Kevin, a FullStack developer specializing in React.js, Node.js, ASP.NET I help businesses build websites, dashboards, ERP/CRM systems, workflow automation, and AI integrated applications that improve ef","Need a modern website, business system, or AI powered solution? I'm Kevin, a FullStack developer specializing in React.js, Node.js, ASP.NET I help businesses build websites, dashboards, ERP/CRM systems, workflow automation, and AI integrated applications that improve ef",Not mentioned,Not mentioned,"react, fullstack, developer, node.js, ai","Technology & Engineering, AI / Data Science",react,Tidak disebutkan,46190.437677291666
214,itsranss__,Hi,@itsranss__,https://www.instagram.com/itsranss__/,Content Creator,Teknologi,"Hi, I'm Rantissi, a 17-year-old developer and AI enthusiast from Indonesia. I'm currently building WhiteRoom Lab, an AI-powered learning and productivity platform, and Arkvyl, a technology ecosystem focused on empowering students, creators, and future innovators. My interests include AI, software de","Hi, I'm Rantissi, a 17-year-old developer and AI enthusiast from Indonesia. I'm currently building WhiteRoom Lab, an AI-powered learning and productivity platform, and Arkvyl, a technology ecosystem focused on empowering students, creators, and future innovators. My interests include AI, software de",Not mentioned,Not mentioned,"developer, ai","Technology & Engineering, AI / Data Science",Tidak terdeteksi,Tidak disebutkan,46190.43789898148
652,codingtengahmalam,codingtengahmalam,@codingtengahmalam,https://www.instagram.com/codingtengahmalam/,Content Creator,Teknologi,"Hello. I am Asdita, a Software Engineer, Tech Lead & Tech Content Creator. I focus on helping developers and engineering teams build scalable, production-ready backend systems, while also transforming complex software engineering concepts into accessible, high-qua","Hello. I am Asdita, a Software Engineer, Tech Lead & Tech Content Creator. I focus on helping developers and engineering teams build scalable, production-ready backend systems, while also transforming complex software engineering concepts into accessible, high-qua",Not mentioned,Not mentioned,"software engineer, content creator, engineering, engineer, backend","Technology & Engineering, Content Creation, Engineering",Tidak terdeteksi,Tidak disebutkan,46190.43828761574
37,rusydi.tr51,rusydi.tr51 rusydi.tr51 Hi,@rusydi.tr51,https://www.instagram.com/rusydi.tr51/,Lainnya,Properti,"Hi, I'm Rusydi, an Oceanography graduate from ITB and a General Insurance Claims Professional specializing in Marine, Property, Liability, and Heavy Equipment claims. Experienced in claim investigation, risk assessment, fraud detection, and data analysis. Proficient in Excel","Hi, I'm Rusydi, an Oceanography graduate from ITB and a General Insurance Claims Professional specializing in Marine, Property, Liability, and Heavy Equipment claims. Experienced in claim investigation, risk assessment, fraud detection, and data analysis. Proficient in Excel",Not mentioned,Not mentioned,"python, data analysis, excel","Technology & Engineering, Data & Analytics",python,Tidak disebutkan,46190.43715042824
8,wrdft,wrdft,@wrdft,https://www.instagram.com/wrdft/,Developer,Teknologi,"Proud to call Indonesia home and be part of this energy. 🇮🇩 I've been fortunate enough to spend the last 5+ years building my career as a Senior iOS Engineer, diving deep into SwiftUI and modern architectures, while also leveraging data analytics to build smarter, more impactful apps. For me, it’s","Proud to call Indonesia home and be part of this energy. 🇮🇩 I've been fortunate enough to spend the last 5+ years building my career as a Senior iOS Engineer, diving deep into SwiftUI and modern architectures, while also leveraging data analytics to build smarter, more impactful apps. For me, it’s",Not mentioned,5+ years,"swift, engineer, ios, Senior iOS Engineer","Technology & Engineering, Engineering",swift,5+ tahun,46190.4368365162
85,drekunia,Hi,@drekunia,https://www.instagram.com/drekunia/,Freelancer,Teknologi,"Hi, I'm Andre. I was a Software Engineer with 4YoE, laid off and then unemployed for 2+ years now. Currently I'm stuck in my parents house in the westernmost of Sumatera with no savings, in a region with severely unstable electricity despite having a couple power plants and coal mines. Tried applyin","Hi, I'm Andre. I was a Software Engineer with 4YoE, laid off and then unemployed for 2+ years now. Currently I'm stuck in my parents house in the westernmost of Sumatera with no savings, in a region with severely unstable electricity despite having a couple power plants and coal mines. Tried applyin",Not mentioned,2+ years,"software engineer, engineer","Technology & Engineering, Engineering",Tidak terdeteksi,2+ tahun,46190.437321516205
97,roynurff,roynurff,@roynurff,https://www.instagram.com/roynurff/,Freelancer,Teknologi,"Hi global founders and people! My name is Roy Nurfaza. I recently graduated but have already spent the last year working as a Software Engineer developing critical infrastructure for the Indonesian Ministry of Public Works. I manage hydrological systems, process live data from telemetry loggers, wor","Hi global founders and people! My name is Roy Nurfaza. I recently graduated but have already spent the last year working as a Software Engineer developing critical infrastructure for the Indonesian Ministry of Public Works. I manage hydrological systems, process live data from telemetry loggers, wor",Not mentioned,Not mentioned,"software engineer, engineer","Technology & Engineering, Engineering",Tidak terdeteksi,Tidak disebutkan,46190.43736791667
152,andiehariyadi,andiehariyadi,@andiehariyadi,https://www.instagram.com/andiehariyadi/,Developer,Teknologi,"🇮🇩🇮🇩 Hi world i’m Andie, professional software engineer for 13+ years, im based in indonesia ready to take more experience from outside Indonesia 🙌","🇮🇩🇮🇩 Hi world i’m Andie, professional software engineer for 13+ years, im based in indonesia ready to take more experience from outside Indonesia 🙌",Not mentioned,13+ years,"software engineer, engineer","Technology & Engineering, Engineering",Tidak terdeteksi,13+ tahun,46190.43770277778
225,heibob.jpg,Hi! I’m Habib,@heibob.jpg,https://www.instagram.com/heibob.jpg/,Developer,Teknologi,"Hi! I’m Habib, a software engineer based in Indonesia, with over 3 years experience. Feel free to reach out via DM and let’s have a fruitful discussion 🙌","Hi! I’m Habib, a software engineer based in Indonesia, with over 3 years experience. Feel free to reach out via DM and let’s have a fruitful discussion 🙌",Not mentioned,3 years,"software engineer, engineer","Technology & Engineering, Engineering",Tidak terdeteksi,3+ tahun,46190.43795247685
250,rayhanyovi,Hello! I'm Yovi,@rayhanyovi,https://www.instagram.com/rayhanyovi/,Developer,Teknologi,"Hello! I'm Yovi, a fullstack engineer with 3 years of experience. I have proven experience in building end-to-end solutions with digital products, utilizing various tech stacks but mostly in React and Go environment. My expertise is in ""Product Engineering"" so I can help you turn vague ideas, pain p","Hello! I'm Yovi, a fullstack engineer with 3 years of experience. I have proven experience in building end-to-end solutions with digital products, utilizing various tech stacks but mostly in React and Go environment. My expertise is in ""Product Engineering"" so I can help you turn vague ideas, pain p",Not mentioned,3 years,"react, engineering, fullstack, engineer","Technology & Engineering, Engineering",react,3+ tahun,46190.43805767361
260,tegar_fas_an,tegar_fas_an tegar_fas_an I'm Tegar,@tegar_fas_an,https://www.instagram.com/tegar_fas_an/,Freelancer,Lainnya,"I'm Tegar, a electronic engineering student that have programming talent on IoT and Backend. I can write the program very fast even in weekdays. I already have freelance experience as data scientist.","I'm Tegar, a electronic engineering student that have programming talent on IoT and Backend. I can write the program very fast even in weekdays. I already have freelance experience as data scientist.",Not mentioned,Not mentioned,"programming, engineering, backend","Technology & Engineering, Engineering",Tidak terdeteksi,Tidak disebutkan,46190.43808199074
331,raratdit,Hi,@raratdit,https://www.instagram.com/raratdit/,Developer,Teknologi,"Hi, I’m a Data Engineer and IoT Developer from Indonesia. Starting from $40, I can turn your ideas into working solutions—from sensors in the field to dashboards your team can actually use. Services: • ESP32 prototypes and data loggers • Monitoring systems and IoT dashboards • Automated reports and","Hi, I’m a Data Engineer and IoT Developer from Indonesia. Starting from $40, I can turn your ideas into working solutions—from sensors in the field to dashboards your team can actually use. Services: • ESP32 prototypes and data loggers • Monitoring systems and IoT dashboards • Automated reports and",Not mentioned,Not mentioned,"developer, engineer","Technology & Engineering, Engineering",Tidak terdeteksi,Tidak disebutkan,46190.43820586806
539,hnstyan,Honestyan here🇮🇩,@hnstyan,https://www.instagram.com/hnstyan/,Developer,Teknologi,"Honestyan here🇮🇩 I’m a 4+ years experienced Software Engineer. I help clients turn ideas and business needs into reliable web, mobile, backend, and IoT systems. I’ve worked on large-scale projects for companies like JNE and Mayora, and I’m confident I can help deliver scalable, practical, and prod","Honestyan here🇮🇩 I’m a 4+ years experienced Software Engineer. I help clients turn ideas and business needs into reliable web, mobile, backend, and IoT systems. I’ve worked on large-scale projects for companies like JNE and Mayora, and I’m confident I can help deliver scalable, practical, and prod",Not mentioned,4+ years,"software engineer, engineer, backend","Technology & Engineering, Engineering",Tidak terdeteksi,4+ tahun,46190.4382875463
607,difaal21,Hiii,@difaal21,https://www.instagram.com/difaal21/,Developer,Teknologi,"Hiii, I'm a software engineer, you can find me here :) https://difaal21.github.io","Hiii, I'm a software engineer, you can find me here :) https://difaal21.github.io",Not mentioned,Not mentioned,"software engineer, engineer","Technology & Engineering, Engineering",Tidak terdeteksi,Tidak disebutkan,46190.43828758102
