source_row,username,name,ig_handle,ig_url,original_category,original_industry,original_message_cleaned,message_english,age,years_of_experience_skills,skills_detailed,skill_category,source_skill_field,source_experience_field,scraped_at
77,irfanbadag,irfanbadag,@irfanbadag,https://www.instagram.com/irfanbadag/,Agency,Teknologi,"Hi there! 👋 I’m Irpan Nurhakim, a 21-year-old passionate creator and hard worker from Cianjur, Indonesia. I bring a unique mix of technical precision, high discipline, and creative artistry to the table. Here is a quick snapshot of what I can do: Core Skills Hardware & Board-Le","Hi there! 👋 I’m Irpan Nurhakim, a 21-year-old passionate creator and hard worker from Cianjur, Indonesia. I bring a unique mix of technical precision, high discipline, and creative artistry to the table. Here is a quick snapshot of what I can do: Core Skills Hardware & Board-Le",Not mentioned,Not mentioned,3d,3D / Animation,3d,Tidak disebutkan,46190.43724820602
220,indrmrs,Hello! I’m Indra,@indrmrs,https://www.instagram.com/indrmrs/,Designer,Desain & Kreatif,"Hello! I’m Indra, a professional jewelry designer with 10 years of experience. I specialize in creating jewelry concepts and turning them into detailed 3D designs. 🙌✨","Hello! I’m Indra, a professional jewelry designer with 10 years of experience. I specialize in creating jewelry concepts and turning them into detailed 3D designs. 🙌✨",Not mentioned,10 years,3d,3D / Animation,3d,10+ tahun,46190.43792491898
285,afinanto,Hi,@afinanto,https://www.instagram.com/afinanto/,Designer,Teknologi,"Hi, I’m Afin! I’m a technology leader with experience spanning two domains: 3D Construction Printing (3DCP) and digital product development. On the construction side, I led Indonesia’s first 3D-printed house, built industrial printing machinery, and secured patents for proprietary hardware and mater","Hi, I’m Afin! I’m a technology leader with experience spanning two domains: 3D Construction Printing (3DCP) and digital product development. On the construction side, I led Indonesia’s first 3D-printed house, built industrial printing machinery, and secured patents for proprietary hardware and mater",Not mentioned,Not mentioned,3d,3D / Animation,3d,Tidak disebutkan,46190.43810586805
519,ardi_beye,Joining the #IndonesiaUnderpriced trend,@ardi_beye,https://www.instagram.com/ardi_beye/,Freelancer,Desain & Kreatif,"Joining the #IndonesiaUnderpriced trend, I want to highly recommend @irahalwahf , a design graduate who is currently focusing on being an animator. Their animation skills are exceptionally clean and absolutely ready to compete globally. Thanks to a strong design background, they have a great visual","Joining the #IndonesiaUnderpriced trend, I want to highly recommend @irahalwahf , a design graduate who is currently focusing on being an animator. Their animation skills are exceptionally clean and absolutely ready to compete globally. Thanks to a strong design background, they have a great visual",Not mentioned,Not mentioned,"animation, animator",3D / Animation,Tidak terdeteksi,Tidak disebutkan,46190.43828753472
605,bagoesbs182,bagoesbs182 bagoesbs182 Hello,@bagoesbs182,https://www.instagram.com/bagoesbs182/,Lainnya,Teknologi,"Hello, i’m Bagus and being a professional 3d artist since 2019 Now im doing 3d generalist, creating 3d assets(modelling and texture), little bit animations, and little bit skill on game engine like unity and unreal. DM me if you want to see my work(i cant share it publicly be","Hello, i’m Bagus and being a professional 3d artist since 2019 Now im doing 3d generalist, creating 3d assets(modelling and texture), little bit animations, and little bit skill on game engine like unity and unreal. DM me if you want to see my work(i cant share it publicly be",Not mentioned,Not mentioned,3d,3D / Animation,3d,Tidak disebutkan,46190.43828758102
598,wahyu.indraman,wahyu.indraman,@wahyu.indraman,https://www.instagram.com/wahyu.indraman/,Startup,Desain & Kreatif,"I’ve been working on Miniatur Cloud — a platform that turns real-world map locations into printable 3D miniature cities. The idea is to combine interactive 3D maps, AI-generated buildings, digital twin traffic simulation, CCTV/computer vision data, social sharing, ratin","I’ve been working on Miniatur Cloud — a platform that turns real-world map locations into printable 3D miniature cities. The idea is to combine interactive 3D maps, AI-generated buildings, digital twin traffic simulation, CCTV/computer vision data, social sharing, ratin",Not mentioned,Not mentioned,"3d, ai","3D / Animation, AI / Data Science",3d,Tidak disebutkan,46190.43828758102
18,nizarudinyusril,nizarudinyusril,@nizarudinyusril,https://www.instagram.com/nizarudinyusril/,Agency,Teknologi,"Hi! I'm Yusril Lana, Founder of @studiolentera_ , an architecture studio based in Indonesia 🇮🇩. We help homeowners, developers, and businesses create spaces that are not only visually appealing, but also functional, adaptive, and sustainable for the future. . . ✨ Ex","Hi! I'm Yusril Lana, Founder of @studiolentera_ , an architecture studio based in Indonesia 🇮🇩. We help homeowners, developers, and businesses create spaces that are not only visually appealing, but also functional, adaptive, and sustainable for the future. . . ✨ Ex",Not mentioned,Not mentioned,"3d, architecture","3D / Animation, Architecture / Interior",3d,Tidak disebutkan,46190.43708004629
521,zy3d_visual,zy3d_visual,@zy3d_visual,https://www.instagram.com/zy3d_visual/,Designer,Desain & Kreatif,"I’m a 3D Architectural Visualization Artist specializing in high-end, photorealistic rendering. I help architects and interior designers turn their design concepts into premium visuals that perfectly capture the intended mood and details.","I’m a 3D Architectural Visualization Artist specializing in high-end, photorealistic rendering. I help architects and interior designers turn their design concepts into premium visuals that perfectly capture the intended mood and details.",Not mentioned,Not mentioned,"3d, interior","3D / Animation, Architecture / Interior",3d,Tidak disebutkan,46190.43828753472
210,markeugal,Hello! I'm Galuh Lutfia,@markeugal,https://www.instagram.com/markeugal/,Agency,Teknologi,"Hello! I'm Galuh Lutfia, a Building Construction Engineering graduate from Politeknik Negeri Jakarta and the founder of GeeF Studio. I am passionate about residential design, architecture, and creative digital products. My background in construction engineering allows me to create designs that are n","Hello! I'm Galuh Lutfia, a Building Construction Engineering graduate from Politeknik Negeri Jakarta and the founder of GeeF Studio. I am passionate about residential design, architecture, and creative digital products. My background in construction engineering allows me to create designs that are n",Not mentioned,Not mentioned,"3d, architecture, engineering","3D / Animation, Architecture / Interior, Engineering",3d,Tidak disebutkan,46190.43789898148
158,ferdzvyy,Hello,@ferdzvyy,https://www.instagram.com/ferdzvyy/,Developer,Teknologi,"Hello, my name is Muhammad Ferdiansyah. I am a 10th-grade vocational high school student currently learning and developing skills in civil engineering and architecture. I have basic skills in AutoCAD 2D, SketchUp 3D, and technical drawing. I am eager to learn, able to work in a team, and motivated t","Hello, my name is Muhammad Ferdiansyah. I am a 10th-grade vocational high school student currently learning and developing skills in civil engineering and architecture. I have basic skills in AutoCAD 2D, SketchUp 3D, and technical drawing. I am eager to learn, able to work in a team, and motivated t",Not mentioned,10+ years,"3d, architecture, engineering, drawing","3D / Animation, Architecture / Interior, Engineering, Creative & Design",3d,10+ tahun,46190.43770277778
450,clintonsanto,clintonsanto clintonsanto Clinton,@clintonsanto,https://www.instagram.com/clintonsanto/,Freelancer,Teknologi,"Clinton, 33. Content Creator | Game Designer | Gaming Polymath [LFG] LF small team with like-minded people who are passionate about gaming beyond just playing—game design, systems, progression, monetization, industry trends, and what makes games succeed or fail. Interested","Clinton, 33. Content Creator | Game Designer | Gaming Polymath [LFG] LF small team with like-minded people who are passionate about gaming beyond just playing—game design, systems, progression, monetization, industry trends, and what makes games succeed or fail. Interested",Not mentioned,Not mentioned,"3d, content creator","3D / Animation, Content Creation",3d,Tidak disebutkan,46190.4382875
463,bagus_jaler,bagus_jaler bagus_jaler Hello my name is Bagus,@bagus_jaler,https://www.instagram.com/bagus_jaler/,Designer,Teknologi,"Hello my name is Bagus, iam a engineer, with engineering design skill, I can use 2d cad and 3d cad (AutoCAD, Solidwork) if any of u have a idea, I can design it for u, so please contact me on DM","Hello my name is Bagus, iam a engineer, with engineering design skill, I can use 2d cad and 3d cad (AutoCAD, Solidwork) if any of u have a idea, I can design it for u, so please contact me on DM",Not mentioned,Not mentioned,"3d, engineering, engineer","3D / Animation, Engineering",3d,Tidak disebutkan,46190.43828751158
593,kikitsch__,Hi everyone,@kikitsch__,https://www.instagram.com/kikitsch__/,Agency,Desain & Kreatif,"Hi everyone, if you’re planning a building project or need help with construction design, my husband holds a Bachelor's Degree in Civil Engineering with 11 years of experience and offers services in AutoCAD drafting, 3D SketchUp, RAB/RAP estimation, and ETABS/SAP 2000 structural analysis—please feel","Hi everyone, if you’re planning a building project or need help with construction design, my husband holds a Bachelor's Degree in Civil Engineering with 11 years of experience and offers services in AutoCAD drafting, 3D SketchUp, RAB/RAP estimation, and ETABS/SAP 2000 structural analysis—please feel",Not mentioned,11 years,"3d, engineering","3D / Animation, Engineering",3d,11+ tahun,46190.43828758102
671,leilinor_novianto,leilinor_novianto leilinor_novianto Hallo,@leilinor_novianto,https://www.instagram.com/leilinor_novianto/,Agency,Teknologi,"Hallo, my name is Lia. I am Architect from Indonesia. For $50 I can make your Floorplan and 3D Architectural Design or Marketing Kit for your property. I can speak English & Malay. My porthofolio can be seen on tiktok @nuevoarch and IG @leilinorstudio #HireIndones","Hallo, my name is Lia. I am Architect from Indonesia. For $50 I can make your Floorplan and 3D Architectural Design or Marketing Kit for your property. I can speak English & Malay. My porthofolio can be seen on tiktok @nuevoarch and IG @leilinorstudio #HireIndones",Not mentioned,Not mentioned,"3d, marketing, architect, english","3D / Animation, Marketing & Growth, Architecture / Interior, Language / Translation",3d,Tidak disebutkan,46190.43828761574
166,mzen.zain,Hello,@mzen.zain,https://www.instagram.com/mzen.zain/,Agency,Desain & Kreatif,"Hello, my name is Mazain Rizqi Akbar. A 3D Animation student from SMK Plus NU Sidoarjo with 6 months of industrial internship experience at MOCCA STUDIO GROUP, Malang. Possesses a solid understanding of fundamental animation principles, body mechanics, and character acting, backed by excellent perfo","Hello, my name is Mazain Rizqi Akbar. A 3D Animation student from SMK Plus NU Sidoarjo with 6 months of industrial internship experience at MOCCA STUDIO GROUP, Malang. Possesses a solid understanding of fundamental animation principles, body mechanics, and character acting, backed by excellent perfo",Not mentioned,Not mentioned,"3d, animation, acting","3D / Animation, Talent / Performing Arts",3d,Tidak disebutkan,46190.43775398148
574,harizabori,Hello,@harizabori,https://www.instagram.com/harizabori/,Agency,Teknologi,"Hello, I’m Muhamad Hariza. I’m a Product Concept Developer, 3D Designer, and Manufacturing Specialist. I help turn ideas into production-ready products, from concept and 3D design through to the manufacturing process using CNC, laser cutting, and various other production techniques. I also have expe","Hello, I’m Muhamad Hariza. I’m a Product Concept Developer, 3D Designer, and Manufacturing Specialist. I help turn ideas into production-ready products, from concept and 3D design through to the manufacturing process using CNC, laser cutting, and various other production techniques. I also have expe",Not mentioned,Not mentioned,"3d, 3d design, developer","3D / Animation, Technology & Engineering",3d,Tidak disebutkan,46190.43828756944
211,jagd_19,Hi,@jagd_19,https://www.instagram.com/jagd_19/,Agency,Teknologi,"Hi, I'm Taufiq. Technical 3D Generalist, Game Developer, and Software Engineer. 4+ years crafting production-ready 3D assets and real-time content with Blender & Maya. Built games with Unity & Unreal Engine while leveraging 5+ years of programming experience to streamline pipelines and gameplay syst","Hi, I'm Taufiq. Technical 3D Generalist, Game Developer, and Software Engineer. 4+ years crafting production-ready 3D assets and real-time content with Blender & Maya. Built games with Unity & Unreal Engine while leveraging 5+ years of programming experience to streamline pipelines and gameplay syst",Not mentioned,4+ years,"3d, blender, software engineer, game developer, programming, developer, engineer","3D / Animation, Technology & Engineering, Engineering","3d, blender",4+ tahun,46190.43789898148
27,jhordideamarall,jhordideamarall jhordideamarall hai,@jhordideamarall,https://www.instagram.com/jhordideamarall/,Lainnya,Lainnya,"hai, im Jhordi im building https://mira-ai.chat","hai, im Jhordi im building https://mira-ai.chat",Not mentioned,Not mentioned,ai,AI / Data Science,Tidak terdeteksi,Tidak disebutkan,46190.43708004629
92,ronalsagala_,ronalsagala_ ronalsagala_ Hello world,@ronalsagala_,https://www.instagram.com/ronalsagala_/,Agency,Teknologi,"Hello world, I'm Ronald Graduate at Bachelor of Communications Science. I'm not a professional worker but I guarantee to do the best with your company business. I have experience in AI Automation make your flow in your company seamless and optimised, Can Do AI Automation li","Hello world, I'm Ronald Graduate at Bachelor of Communications Science. I'm not a professional worker but I guarantee to do the best with your company business. I have experience in AI Automation make your flow in your company seamless and optimised, Can Do AI Automation li",Not mentioned,Not mentioned,ai,AI / Data Science,Tidak terdeteksi,Tidak disebutkan,46190.43734570602
191,noellucan,noellucan,@noellucan,https://www.instagram.com/noellucan/,Lainnya,Media & Entertainment,"Hi! I’m Noel 👋 Currently learning and exploring AI workflows, content systems, and digital media. I enjoy building, experimenting, and discovering new ways AI can support creativity and everyday work. Open to collaborations, interesting projects, and opportunities to grow and learn.","Hi! I’m Noel 👋 Currently learning and exploring AI workflows, content systems, and digital media. I enjoy building, experimenting, and discovering new ways AI can support creativity and everyday work. Open to collaborations, interesting projects, and opportunities to grow and learn.",Not mentioned,Not mentioned,ai,AI / Data Science,Tidak terdeteksi,Tidak disebutkan,46190.43782641204
373,surya_fitaiowner,surya_fitaiowner,@surya_fitaiowner,https://www.instagram.com/surya_fitaiowner/,Agency,Teknologi,"Proud to be Indonesian 🇮🇩 I currently serve as a firefighter, and outside of my duty, I'm building something I'm deeply passionate about: Surya-FitAi, an AI-powered online personal trainer platform designed to make fitness guidance accessible to everyone. The goal","Proud to be Indonesian 🇮🇩 I currently serve as a firefighter, and outside of my duty, I'm building something I'm deeply passionate about: Surya-FitAi, an AI-powered online personal trainer platform designed to make fitness guidance accessible to everyone. The goal",Not mentioned,Not mentioned,ai,AI / Data Science,Tidak terdeteksi,Tidak disebutkan,46190.43828746528
384,jonathandevrinno,jonathandevrinno,@jonathandevrinno,https://www.instagram.com/jonathandevrinno/,Startup,Teknologi,"If you are a founder or business owner who needs to focus on important tasks, nice to meet you! My name is Devrin. Currently im working on AI Automations, help you to do low & repetitive tasks. I also do customize service to fit your company needs. DM for details!🙌","If you are a founder or business owner who needs to focus on important tasks, nice to meet you! My name is Devrin. Currently im working on AI Automations, help you to do low & repetitive tasks. I also do customize service to fit your company needs. DM for details!🙌",Not mentioned,Not mentioned,ai,AI / Data Science,Tidak terdeteksi,Tidak disebutkan,46190.43828746528
443,byadamamrullah,byadamamrullah byadamamrullah Hi,@byadamamrullah,https://www.instagram.com/byadamamrullah/,Lainnya,Media & Entertainment,"Hi, I help companies scale revenue with paid media and AI-driven growth. Check for more details: adam.boostwithai.se","Hi, I help companies scale revenue with paid media and AI-driven growth. Check for more details: adam.boostwithai.se",Not mentioned,Not mentioned,ai,AI / Data Science,Tidak terdeteksi,Tidak disebutkan,46190.4382875
585,tsaniannadia,tsaniannadia,@tsaniannadia,https://www.instagram.com/tsaniannadia/,Startup,Lainnya,"Hi! Tsania is here. Curently I work as a Data Annotator and AI Data Collector in several global companies. I start doing this job since 2023 and getting serious in this year. As an Annotator, I called myself a detail oriented person. Very open for any chance in Annotator jo","Hi! Tsania is here. Curently I work as a Data Annotator and AI Data Collector in several global companies. I start doing this job since 2023 and getting serious in this year. As an Annotator, I called myself a detail oriented person. Very open for any chance in Annotator jo",Not mentioned,Not mentioned,ai,AI / Data Science,Tidak terdeteksi,Tidak disebutkan,46190.43828756944
482,bangpalsayoga,bangpalsayoga bangpalsayoga Hi,@bangpalsayoga,https://www.instagram.com/bangpalsayoga/,Developer,Teknologi,"Hi, I'm an AI/ML Engineer & Data Scientist with 3+ years of experience in AI engineering, machine learning models, and high-impact BI dashboards at one of Indonesia's largest banks. My work has reached thousands of daily users, and I've been recognized as a Top 10 Global","Hi, I'm an AI/ML Engineer & Data Scientist with 3+ years of experience in AI engineering, machine learning models, and high-impact BI dashboards at one of Indonesia's largest banks. My work has reached thousands of daily users, and I've been recognized as a Top 10 Global",Not mentioned,3+ years,"machine learning, engineering, engineer, ai, AI/ML Engineer","AI / Data Science, Engineering",Tidak terdeteksi,3+ tahun,46190.438287523146
454,morn4869_,Hi,@morn4869_,https://www.instagram.com/morn4869_/,Freelancer,Teknologi,"Hi, I'm Mori, a Product Manager based in Jakarta with 3 years of experience building B2C, B2B, and operational platforms across healthtech, HR SaaS, and AI products. I've shipped 9 features for an HCM platform, launched a mental health B2B service that secured the company's first enterprise client,","Hi, I'm Mori, a Product Manager based in Jakarta with 3 years of experience building B2C, B2B, and operational platforms across healthtech, HR SaaS, and AI products. I've shipped 9 features for an HCM platform, launched a mental health B2B service that secured the company's first enterprise client,",Not mentioned,3 years,"ai, hr","AI / Data Science, Human Resources",Tidak terdeteksi,3+ tahun,46190.4382875
43,daviqjalaludinrumi,daviqjalaludinrumi,@daviqjalaludinrumi,https://www.instagram.com/daviqjalaludinrumi/,Designer,Desain & Kreatif,"assalamualaikum, hello everyone im daviq i'm a professional archirtect I’m not the smartest architect. Not the most visionary designer. Not the loudest voice in the room. But I’ve spent years learning how spaces are understood before they are built. How ideas be","assalamualaikum, hello everyone im daviq i'm a professional archirtect I’m not the smartest architect. Not the most visionary designer. Not the loudest voice in the room. But I’ve spent years learning how spaces are understood before they are built. How ideas be",Not mentioned,Not mentioned,architect,Architecture / Interior,Tidak terdeteksi,Tidak disebutkan,46190.437150439815
73,mesanatadenta,mesanatadenta mesanatadenta Hi,@mesanatadenta,https://www.instagram.com/mesanatadenta/,Startup,Teknologi,"Hi, I'm Mesa A first-year architecture student at ITB, GREENSHIP Associate, and founder of the Sustainable Architecture Society (SAS). SAS is built around one question: ""How do we develop architecture that participates in the metabolism of living systems?"" 🌿 It position","Hi, I'm Mesa A first-year architecture student at ITB, GREENSHIP Associate, and founder of the Sustainable Architecture Society (SAS). SAS is built around one question: ""How do we develop architecture that participates in the metabolism of living systems?"" 🌿 It position",Not mentioned,Not mentioned,architecture,Architecture / Interior,Tidak terdeteksi,Tidak disebutkan,46190.4372215625
106,soulthans,Hi,@soulthans,https://www.instagram.com/soulthans/,Designer,Teknologi,"Hi, I’m Sultan an interior designer with a passion for creating thoughtful, well crafted living spaces. I specialize in designing areas like bedrooms, family rooms, and kitchens, balancing aesthetics with functionality. In my work, I take a hands-on approach, from developing design concepts to coord","Hi, I’m Sultan an interior designer with a passion for creating thoughtful, well crafted living spaces. I specialize in designing areas like bedrooms, family rooms, and kitchens, balancing aesthetics with functionality. In my work, I take a hands-on approach, from developing design concepts to coord",Not mentioned,Not mentioned,interior,Architecture / Interior,Tidak terdeteksi,Tidak disebutkan,46190.43741576389
257,dhikacece51,dhikacece51,@dhikacece51,https://www.instagram.com/dhikacece51/,Designer,Desain & Kreatif,"Hi there! My name is Dhika. I am an Architect, and my passion lies in planning and designing beautiful, functional buildings and houses. Given my background and experience, I’m confident I can help you with exactly what you need. Looking forward to hearing about your project!","Hi there! My name is Dhika. I am an Architect, and my passion lies in planning and designing beautiful, functional buildings and houses. Given my background and experience, I’m confident I can help you with exactly what you need. Looking forward to hearing about your project!",Not mentioned,Not mentioned,architect,Architecture / Interior,Tidak terdeteksi,Tidak disebutkan,46190.43805768518
262,dedysisnanto,dedysisnanto dedysisnanto Hi everyone,@dedysisnanto,https://www.instagram.com/dedysisnanto/,Designer,Desain & Kreatif,"Hi everyone,Dedy Here. I am a professional architect also professional designer at 99designs. I had some client in USA and Netherland and more. Indonesian has many good talented peoples and also have strong will to compete with other people in many competitions. Feel free t","Hi everyone,Dedy Here. I am a professional architect also professional designer at 99designs. I had some client in USA and Netherland and more. Indonesian has many good talented peoples and also have strong will to compete with other people in many competitions. Feel free t",Not mentioned,Not mentioned,"architect, professional architect also professional designer",Architecture / Interior,Tidak terdeteksi,Tidak disebutkan,46190.43808199074
437,khrisna_adp,khrisna_adp khrisna_adp Hi everyone! 👋,@khrisna_adp,https://www.instagram.com/khrisna_adp/,Designer,Desain & Kreatif,"Hi everyone! 👋 We are @krya.design, specializing in interior design. ✏️ Our team has 10 years of experience in residential, commercial, and office projects. ✏️ Available for remote work worldwide! If you're looking for a collaboration, let's connect! 🤝","Hi everyone! 👋 We are @krya.design, specializing in interior design. ✏️ Our team has 10 years of experience in residential, commercial, and office projects. ✏️ Available for remote work worldwide! If you're looking for a collaboration, let's connect! 🤝",Not mentioned,10 years,interior,Architecture / Interior,Tidak terdeteksi,10+ tahun,46190.4382875
451,liviaalara,Name ➡️ Livia,@liviaalara,https://www.instagram.com/liviaalara/,Designer,Desain & Kreatif,Name ➡️ Livia Skills ➡️ Graphic Designer & Interior Designer Experience ➡️ Working & communicating with international clients for almost 5 years See my portfolio & linked in page in my bio,Name ➡️ Livia Skills ➡️ Graphic Designer & Interior Designer Experience ➡️ Working & communicating with international clients for almost 5 years See my portfolio & linked in page in my bio,Not mentioned,5 years,interior,Architecture / Interior,Tidak terdeteksi,5+ tahun,46190.4382875
