source_row,username,name,ig_handle,ig_url,original_category,original_industry,original_message_cleaned,message_english,age,years_of_experience_skills,skills_detailed,skill_category,source_skill_field,source_experience_field,scraped_at
656,made.bintoro,made.bintoro made.bintoro Hi,@made.bintoro,https://www.instagram.com/made.bintoro/,Designer,Desain & Kreatif,"Hi, I’m Bian! I'm a graphic designer with 4 years of experience! I can create designs for posters, banners, Instagram feeds, stories, and more. I've worked with major clients like Informa, Ace Hardware, Kawan Lama Group, and several land transportation companies like PT. Ma","Hi, I’m Bian! I'm a graphic designer with 4 years of experience! I can create designs for posters, banners, Instagram feeds, stories, and more. I've worked with major clients like Informa, Ace Hardware, Kawan Lama Group, and several land transportation companies like PT. Ma",Not mentioned,4 years,graphic designer,Other / Multidisciplinary,Tidak terdeteksi,4+ tahun,46190.43828761574
532,firgiawan.id,firgiawan.id firgiawan.id Hi everyone,@firgiawan.id,https://www.instagram.com/firgiawan.id/,Freelancer,Teknologi,"Hi everyone, I’m Awan from Makassar, Indonesia 👋 My interest in technology led me to study Informatics and Computer Engineering Education at Universitas Negeri Makassar, where I keep learning and growing in the IT field. ‎ I’m most familiar with web development and enjoy b","Hi everyone, I’m Awan from Makassar, Indonesia 👋 My interest in technology led me to study Informatics and Computer Engineering Education at Universitas Negeri Makassar, where I keep learning and growing in the IT field. ‎ I’m most familiar with web development and enjoy b",Not mentioned,Not mentioned,"flutter, kotlin, engineering","Other / Multidisciplinary, Engineering","flutter, kotlin",Tidak disebutkan,46190.4382875463
330,_rizfarizriz,_rizfarizriz _rizfarizriz Hi,@_rizfarizriz,https://www.instagram.com/_rizfarizriz/,Lainnya,Teknologi,"Hi, I'm an IT Finance Business Analyst from Indonesia. For $40/hour, I can help you turn business ideas and operational challenges into clear system requirements and actionable solutions. Services include: • Requirement Gathering • Business Process Analysis • Process Flow &","Hi, I'm an IT Finance Business Analyst from Indonesia. For $40/hour, I can help you turn business ideas and operational challenges into clear system requirements and actionable solutions. Services include: • Requirement Gathering • Business Process Analysis • Process Flow &",Not mentioned,Not mentioned,"business analyst, finance, IT Finance Business Analyst","Other / Multidisciplinary, Finance & Accounting",business analyst,Tidak disebutkan,46190.43820586806
662,ervan_chodry,ervan_chodry ervan_chodry Hi,@ervan_chodry,https://www.instagram.com/ervan_chodry/,Agency,Teknologi,"Hi, Ervan here 🙌, im a software developer with 2+ years experience. My current tech stack is Next JS, Typescript, Laravel, and SQL, but im very open to learn new stack. I also experienced at DevOps and SEO optimizing. You can find me at LinkedIn: Ervan Chodry See translati","Hi, Ervan here 🙌, im a software developer with 2+ years experience. My current tech stack is Next JS, Typescript, Laravel, and SQL, but im very open to learn new stack. I also experienced at DevOps and SEO optimizing. You can find me at LinkedIn: Ervan Chodry See translati",Not mentioned,2+ years,"laravel, seo, developer, sql","Other / Multidisciplinary, Marketing & Growth, Technology & Engineering, Data & Analytics","laravel, seo",2+ tahun,46190.43828761574
208,probsasko,Hi,@probsasko,https://www.instagram.com/probsasko/,Developer,Teknologi,"Hi, I’m Probo. I have 10+ years of experience in content writing, SEO, WordPress, and website development. Over the years, I have built and managed several websites, developed SEO-based content strategies, and worked on custom WordPress features to improve website performance and user experience. I","Hi, I’m Probo. I have 10+ years of experience in content writing, SEO, WordPress, and website development. Over the years, I have built and managed several websites, developed SEO-based content strategies, and worked on custom WordPress features to improve website performance and user experience. I",Not mentioned,10+ years,"wordpress, seo, content writing, writing","Other / Multidisciplinary, Marketing & Growth, Writing & Content","wordpress, seo, content writing",10+ tahun,46190.43789898148
589,renoiyr,Hi everyone! 👋,@renoiyr,https://www.instagram.com/renoiyr/,Freelancer,Desain & Kreatif,"Hi everyone! 👋 I'm a Senior Quality Assurance / Test Analyst from Indonesia with 4 years of experience in the banking and telecommunications industry. I've worked with companies such as PT Jasamarga Tbk, PT Bank Mandiri Tbk, and Telkomsel, creating test plans, test scenarios, and test designs for b","Hi everyone! 👋 I'm a Senior Quality Assurance / Test Analyst from Indonesia with 4 years of experience in the banking and telecommunications industry. I've worked with companies such as PT Jasamarga Tbk, PT Bank Mandiri Tbk, and Telkomsel, creating test plans, test scenarios, and test designs for b",Not mentioned,4 years,"agile, quality assurance, Senior Quality Assurance / Test Analyst","Other / Multidisciplinary, Quality Assurance",agile,4+ tahun,46190.43828756944
47,hiro.fx,Hi,@hiro.fx,https://www.instagram.com/hiro.fx/,Lainnya,Digital Marketing,"Hi, I'm a Video Editor based in Indonesia. For $50, I can help your company create an engaging content video for social media. For $50, I can deliver one high quality short form video complete with dynamic cuts using Premiere Pro or CapCut, captions, basic color grading, and royalty free music. You","Hi, I'm a Video Editor based in Indonesia. For $50, I can help your company create an engaging content video for social media. For $50, I can deliver one high quality short form video complete with dynamic cuts using Premiere Pro or CapCut, captions, basic color grading, and royalty free music. You",Not mentioned,Not mentioned,"premiere, social media, editor, music, Video Editor","Other / Multidisciplinary, Social Media & Community, Video & Motion, Voice / Audio",premiere,Tidak disebutkan,46190.437200520835
81,firdaus1453,firdaus1453 firdaus1453 Hi,@firdaus1453,https://www.instagram.com/firdaus1453/,Freelancer,Teknologi,"Hi, I’m Firdaus 🇮🇩 Mobile App Developer with 5+ years of experience building Android apps. I’ve worked on government EdTech products serving 4M+ teachers, enterprise apps used by thousands of field officers, and custom web platforms for schools and events. My stack: Kotlin,","Hi, I’m Firdaus 🇮🇩 Mobile App Developer with 5+ years of experience building Android apps. I’ve worked on government EdTech products serving 4M+ teachers, enterprise apps used by thousands of field officers, and custom web platforms for schools and events. My stack: Kotlin,",Not mentioned,5+ years,"kotlin, swift, postgresql, developer","Other / Multidisciplinary, Technology & Engineering","kotlin, swift, postgresql",5+ tahun,46190.437298206016
164,aqillatas33,aqillatas33 aqillatas33 Hi,@aqillatas33,https://www.instagram.com/aqillatas33/,Freelancer,Teknologi,"Hi, I’m Agil, a Backend Developer with 4+ years of experience building scalable web applications and APIs using Go (Golang). I’ve worked on projects involving PostgreSQL, Redis, microservices, third party integrations, payment systems, and cloud based architectures. I can hel","Hi, I’m Agil, a Backend Developer with 4+ years of experience building scalable web applications and APIs using Go (Golang). I’ve worked on projects involving PostgreSQL, Redis, microservices, third party integrations, payment systems, and cloud based architectures. I can hel",Not mentioned,4+ years,"postgresql, developer, backend","Other / Multidisciplinary, Technology & Engineering",postgresql,4+ tahun,46190.43775398148
319,ekapasha17,Hello you could call me eka,@ekapasha17,https://www.instagram.com/ekapasha17/,Developer,Lainnya,"Hello you could call me eka, I am a backend developer that used to use laravel, mysql, redis and graphql to build the scalable backend that could help you save your business needs","Hello you could call me eka, I am a backend developer that used to use laravel, mysql, redis and graphql to build the scalable backend that could help you save your business needs",Not mentioned,Not mentioned,"laravel, mysql, developer, backend, backend developer","Other / Multidisciplinary, Technology & Engineering","laravel, mysql",Tidak disebutkan,46190.43817951389
321,rezaachmad_n,rezaachmad_n rezaachmad_n Hi! I’m Reza,@rezaachmad_n,https://www.instagram.com/rezaachmad_n/,Freelancer,Teknologi,"Hi! I’m Reza, a Backend & Full-Stack Developer from Indonesia 🇮🇩 I help businesses build websites, APIs, dashboards, and scalable backend systems. Tech: Node.js, NestJS, MySQL, PostgreSQL, MongoDB, AWS, etc. 📧 reza.achmad.naufal@gmail.com Open for freelance, contract, an","Hi! I’m Reza, a Backend & Full-Stack Developer from Indonesia 🇮🇩 I help businesses build websites, APIs, dashboards, and scalable backend systems. Tech: Node.js, NestJS, MySQL, PostgreSQL, MongoDB, AWS, etc. 📧 reza.achmad.naufal@gmail.com Open for freelance, contract, an",Not mentioned,Not mentioned,"mysql, postgresql, full-stack, developer, node.js, backend","Other / Multidisciplinary, Technology & Engineering","mysql, postgresql",Tidak disebutkan,46190.43817951389
640,rofyfirm,Hi,@rofyfirm,https://www.instagram.com/rofyfirm/,Developer,Lainnya,"Hi, I'm Rofy and having 6+ years experiences of an Native Android Developer. I do my stuff on Kotlin or Jetpack Compose. DM me if you interested","Hi, I'm Rofy and having 6+ years experiences of an Native Android Developer. I do my stuff on Kotlin or Jetpack Compose. DM me if you interested",Not mentioned,6+ years,"kotlin, developer","Other / Multidisciplinary, Technology & Engineering",kotlin,6+ tahun,46190.43828760416
660,madrjl,madrjl,@madrjl,https://www.instagram.com/madrjl/,Freelancer,Teknologi,"Hi everyone! I am Rijal. I'm currently available for freelance opportunities. If you need help with Laravel or JavaScript projects, whether it's building a website, fixing bugs, maintaining an existing application, adding new features, or integrating third-party APIs, I'd be happy to help. Feel free","Hi everyone! I am Rijal. I'm currently available for freelance opportunities. If you need help with Laravel or JavaScript projects, whether it's building a website, fixing bugs, maintaining an existing application, adding new features, or integrating third-party APIs, I'd be happy to help. Feel free",Not mentioned,Not mentioned,"laravel, java, javascript","Other / Multidisciplinary, Technology & Engineering","laravel, java",Tidak disebutkan,46190.43828761574
67,reinhartsamuel,reinhartsamuel,@reinhartsamuel,https://www.instagram.com/reinhartsamuel/,Developer,Teknologi,"Looking for a Smart Contract engineer? I am a software engineer focusing on Web3 Dapp and smart contract protocol engineering with 5 years of experience. I work with Foundry smart contract development suite, blockchain indexers, and front end wallet integration. Tech st","Looking for a Smart Contract engineer? I am a software engineer focusing on Web3 Dapp and smart contract protocol engineering with 5 years of experience. I work with Foundry smart contract development suite, blockchain indexers, and front end wallet integration. Tech st",Not mentioned,5 years,"nodejs, software engineer, engineering, engineer","Other / Multidisciplinary, Technology & Engineering, Engineering",nodejs,5+ tahun,46190.43722155093
544,syofyan_zuhad,syofyan_zuhad syofyan_zuhad Hello,@syofyan_zuhad,https://www.instagram.com/syofyan_zuhad/,Agency,Teknologi,"Hello, I'm Syofyan Zuhad, a full-stack software engineer specializing in building scalable web applications and resilient infrastructure. My technical expertise bridges modern frontend frameworks like Vue 3 and TypeScript with robust backend architectures using Laravel an","Hello, I'm Syofyan Zuhad, a full-stack software engineer specializing in building scalable web applications and resilient infrastructure. My technical expertise bridges modern frontend frameworks like Vue 3 and TypeScript with robust backend architectures using Laravel an",Not mentioned,Not mentioned,"vue, laravel, software engineer, full-stack, frontend, engineer, backend","Other / Multidisciplinary, Technology & Engineering, Engineering","vue, laravel",Tidak disebutkan,46190.4382875463
395,zyn_daily,Join !!!,@zyn_daily,https://www.instagram.com/zyn_daily/,Agency,Teknologi,"Join !!! Hi, I'm Zen. Software Engineer / Web Developer specialize in VueJs with 4+ year exp 🙌 some of my proven works: - Build realtime vessel tracking with GIS-based web. - Build company job vacancy portal web that seamlessly connects registration, interview, to acceptance Currently, I'm working","Join !!! Hi, I'm Zen. Software Engineer / Web Developer specialize in VueJs with 4+ year exp 🙌 some of my proven works: - Build realtime vessel tracking with GIS-based web. - Build company job vacancy portal web that seamlessly connects registration, interview, to acceptance Currently, I'm working",Not mentioned,4+ years,"vue, software engineer, web developer, developer, engineer, gis","Other / Multidisciplinary, Technology & Engineering, Engineering, GIS / Mapping",vue,4+ tahun,46190.43828747685
457,zaffirmz,HI I'm Hikmal,@zaffirmz,https://www.instagram.com/zaffirmz/,Designer,Desain & Kreatif,"HI I'm Hikmal, a 2d Artist and UI/UX Designer spesializing in game development. I craft engaging visual experiences from character and enviroment art to intuitive in game interfaces that player love to interact with.","HI I'm Hikmal, a 2d Artist and UI/UX Designer spesializing in game development. I craft engaging visual experiences from character and enviroment art to intuitive in game interfaces that player love to interact with.",Not mentioned,Not mentioned,"ui, ux, ui/ux","Other / Multidisciplinary, UI/UX & Product Design",ui/ux,Tidak disebutkan,46190.43828751158
508,izza.haridhi,izza.haridhi izza.haridhi Hello.! My name is Izza,@izza.haridhi,https://www.instagram.com/izza.haridhi/,Designer,Desain & Kreatif,"Hello.! My name is Izza, a T-shaped designer with specialization on graphic and brand design, alongside with UI/UX. I’ve handled many head of creative design positions since 2022, as you observed from my LinkedIn. If you need a multidisciplinary, minimalist-style designer,","Hello.! My name is Izza, a T-shaped designer with specialization on graphic and brand design, alongside with UI/UX. I’ve handled many head of creative design positions since 2022, as you observed from my LinkedIn. If you need a multidisciplinary, minimalist-style designer,",Not mentioned,Not mentioned,"ui, ux, ui/ux","Other / Multidisciplinary, UI/UX & Product Design",ui/ux,Tidak disebutkan,46190.43828753472
651,zfachrian,Hi,@zfachrian,https://www.instagram.com/zfachrian/,Freelancer,Desain & Kreatif,"Hi, I’m ZUHAD from Indonesia 🇮🇩 Product Designer (UI/UX) helping startups and founders turn ideas into simple, user-friendly digital products. • UX/UI Design • User Flows & Wireframes • MVP Planning • Prototyping • Design Systems Available for freelance and remote projects. Portfolio: https://s.id","Hi, I’m ZUHAD from Indonesia 🇮🇩 Product Designer (UI/UX) helping startups and founders turn ideas into simple, user-friendly digital products. • UX/UI Design • User Flows & Wireframes • MVP Planning • Prototyping • Design Systems Available for freelance and remote projects. Portfolio: https://s.id",Not mentioned,Not mentioned,"ui, ux, ui design, ui/ux","Other / Multidisciplinary, UI/UX & Product Design",ui/ux,Tidak disebutkan,46190.43828760416
305,mrsa.ziq,Hi!!,@mrsa.ziq,https://www.instagram.com/mrsa.ziq/,Designer,Teknologi,"Hi!!, I'm Riziq. I have skills in Data Science, Machine Learning, UI/UX Design, Data Visualization, and digital product development. I have experience working on various data analysis projects and web-based application design. DM for more information🙌","Hi!!, I'm Riziq. I have skills in Data Science, Machine Learning, UI/UX Design, Data Visualization, and digital product development. I have experience working on various data analysis projects and web-based application design. DM for more information🙌",Not mentioned,Not mentioned,"ui, ux, machine learning, data analysis, data science, ui/ux","Other / Multidisciplinary, UI/UX & Product Design, AI / Data Science, Data & Analytics",ui/ux,Tidak disebutkan,46190.43815356481
458,arnoldconstantine,arnoldconstantine arnoldconstantine Hi,@arnoldconstantine,https://www.instagram.com/arnoldconstantine/,Designer,Desain & Kreatif,"Hi, I’m Arnold! 👋🏻 For nearly 11 years, I’ve been living and breathing at the intersection of UI/UX and Graphic Design. I’m not just here to make things look visually stunning—I’m here to bridge the gap between human psychology and business goals. Over the past","Hi, I’m Arnold! 👋🏻 For nearly 11 years, I’ve been living and breathing at the intersection of UI/UX and Graphic Design. I’m not just here to make things look visually stunning—I’m here to bridge the gap between human psychology and business goals. Over the past",Not mentioned,11+ years,"ui, ux, graphic design, psychology, ui/ux","Other / Multidisciplinary, UI/UX & Product Design, Creative & Design, Psychology / Mental Health",ui/ux,11+ tahun,46190.43828751158
362,bout.bill,Hi,@bout.bill,https://www.instagram.com/bout.bill/,Designer,Desain & Kreatif,"Hi, I’m Nabil Achmad, i am a Designpreneurship student at University. I specialize in combining creative strategy with UI/UX and data driven marketing to drive business growth. Having managed my own Event Organizer and led large scale teams, I’m ready to translate complex design problems into measur","Hi, I’m Nabil Achmad, i am a Designpreneurship student at University. I specialize in combining creative strategy with UI/UX and data driven marketing to drive business growth. Having managed my own Event Organizer and led large scale teams, I’m ready to translate complex design problems into measur",Not mentioned,Not mentioned,"ui, ux, event organizer, marketing, ui/ux, event","Other / Multidisciplinary, UI/UX & Product Design, Event & Production, Marketing & Growth",ui/ux,Tidak disebutkan,46190.438287453704
558,indarjp89,Hi,@indarjp89,https://www.instagram.com/indarjp89/,Designer,Teknologi,"Hi, I'm Indar. Experienced as technical support for 7 years. Working in Linux system administration, troubleshooting software and hardware, develop website and improve security especially in WordPress, create UI/UX design. Recently, I focused as bug hunter, finding vulnerability in web app, mobile a","Hi, I'm Indar. Experienced as technical support for 7 years. Working in Linux system administration, troubleshooting software and hardware, develop website and improve security especially in WordPress, create UI/UX design. Recently, I focused as bug hunter, finding vulnerability in web app, mobile a",Not mentioned,7 years,"wordpress, ui, ux, administration, ui/ux","Other / Multidisciplinary, UI/UX & Product Design, Project / Operations","wordpress, ui/ux",7+ tahun,46190.438287557874
636,adeleeeeyyyy,adeleeeeyyyy adeleeeeyyyy Hi! I’m Adly.,@adeleeeeyyyy,https://www.instagram.com/adeleeeeyyyy/,Designer,Teknologi,"Hi! I’m Adly. I help businesses build scalable web applications, powerful APIs, and reliable cloud infrastructures. My expertise combines modern fullstack web development, REST API integration, and UI/UX-focused design with advanced Linux system administration across AWS, G","Hi! I’m Adly. I help businesses build scalable web applications, powerful APIs, and reliable cloud infrastructures. My expertise combines modern fullstack web development, REST API integration, and UI/UX-focused design with advanced Linux system administration across AWS, G",Not mentioned,Not mentioned,"ui, ux, administration, fullstack, ui/ux","Other / Multidisciplinary, UI/UX & Product Design, Project / Operations, Technology & Engineering",ui/ux,Tidak disebutkan,46190.43828760416
350,rianjuliant_,rianjuliant_ rianjuliant_ Hi,@rianjuliant_,https://www.instagram.com/rianjuliant_/,Designer,Teknologi,"Hi, I'm Rian UI/UX Designer and Frontend developer with 5 years experience. u can see my work on https://portofool-dev.netlify.app/ 🚀","Hi, I'm Rian UI/UX Designer and Frontend developer with 5 years experience. u can see my work on https://portofool-dev.netlify.app/ 🚀",Not mentioned,5 years,"ui, ux, developer, frontend, ui/ux, Rian UI/UX Designer","Other / Multidisciplinary, UI/UX & Product Design, Technology & Engineering",ui/ux,5+ tahun,46190.438287453704
551,aetherian0,Hey everyone! 👋🏻,@aetherian0,https://www.instagram.com/aetherian0/,Agency,Teknologi,"Hey everyone! 👋🏻 I'm Jhonathan, founder of CORTEXA — a growth-focused digital agency that combines and provide services UI/UX design, web development, editing, content systems, and AI-powered workflows to help brands build stronger digital ecosystems. One thing I've noticed is that many businesses","Hey everyone! 👋🏻 I'm Jhonathan, founder of CORTEXA — a growth-focused digital agency that combines and provide services UI/UX design, web development, editing, content systems, and AI-powered workflows to help brands build stronger digital ecosystems. One thing I've noticed is that many businesses",Not mentioned,Not mentioned,"ui, ux, editing, ui/ux, ai","Other / Multidisciplinary, UI/UX & Product Design, Video & Motion, AI / Data Science","ui/ux, editing",Tidak disebutkan,46190.438287557874
669,pxsjal_,Hello,@pxsjal_,https://www.instagram.com/pxsjal_/,Lainnya,Desain & Kreatif,"Hello, I'm Pasjal! I’m a young editor with over 3 years of experience in the editing world. I’m highly proficient in CapCut for efficient and flexible project editing, and I am also expanding my skills in Adobe Premiere Pro for more advanced needs. Beyond standard editing, I have foundational skills","Hello, I'm Pasjal! I’m a young editor with over 3 years of experience in the editing world. I’m highly proficient in CapCut for efficient and flexible project editing, and I am also expanding my skills in Adobe Premiere Pro for more advanced needs. Beyond standard editing, I have foundational skills",Not mentioned,3 years,"premiere, motion graphic, editing, editor","Other / Multidisciplinary, Video & Motion","premiere, motion graphic, editing",3+ tahun,46190.43828761574
107,mrta19_,mrta19_,@mrta19_,https://www.instagram.com/mrta19_/,Lainnya,Teknologi,"Hi! I’m a young creative from Indonesia specializing in video editing, cinematography, and visual storytelling. Experienced in short films, commercial content, documentaries, and social media videos. Skilled in Adobe Premiere Pro, DaVinci Resolve, and CapCut (PC & Mobile). Open for remote work and i","Hi! I’m a young creative from Indonesia specializing in video editing, cinematography, and visual storytelling. Experienced in short films, commercial content, documentaries, and social media videos. Skilled in Adobe Premiere Pro, DaVinci Resolve, and CapCut (PC & Mobile). Open for remote work and i",Not mentioned,Not mentioned,"premiere, video editing, editing, social media","Other / Multidisciplinary, Video & Motion, Social Media & Community","premiere, video editing, editing",Tidak disebutkan,46190.43744329861
74,kandias_das,kandias_das kandias_das Hello everyone,@kandias_das,https://www.instagram.com/kandias_das/,Content Creator,Lainnya,"Hello everyone, I’m Muhammad Kandias—a culinary professional with experience as a Commis and a passion for Western & Asian cuisine. Outside the kitchen, I enjoy exploring nature, hiking, and capturing moments through photography while sharing my experiences as an outdoor cont","Hello everyone, I’m Muhammad Kandias—a culinary professional with experience as a Commis and a passion for Western & Asian cuisine. Outside the kitchen, I enjoy exploring nature, hiking, and capturing moments through photography while sharing my experiences as an outdoor cont",Not mentioned,Not mentioned,photography,Photography,photography,Tidak disebutkan,46190.43722157407
145,suedeshots,Hi,@suedeshots,https://www.instagram.com/suedeshots/,Startup,Teknologi,"Hi, I’m Albi, a photographer and visual director from Indonesia. Photography has been a passion of mine for as long as I can remember. There were moments when I thought about leaving it behind, but I always found my way back. I love how a single image can tell a story, capture an emotion, and create","Hi, I’m Albi, a photographer and visual director from Indonesia. Photography has been a passion of mine for as long as I can remember. There were moments when I thought about leaving it behind, but I always found my way back. I love how a single image can tell a story, capture an emotion, and create",Not mentioned,Not mentioned,"photography, photographer",Photography,photography,Tidak disebutkan,46190.437677291666
442,its.raphi_,Yo,@its.raphi_,https://www.instagram.com/its.raphi_/,Lainnya,Media & Entertainment,"Yo, what's up citizens and investors, allow me to introduce myself. My name is Joko Khadafi, I am talented in photography and filmmaking, I am 17 years old and I need your dollars, let's do some collaboration.","Yo, what's up citizens and investors, allow me to introduce myself. My name is Joko Khadafi, I am talented in photography and filmmaking, I am 17 years old and I need your dollars, let's do some collaboration.",17,17+ years,photography,Photography,photography,17+ tahun,46190.4382875
